{
  "title": "Link Loader Episode 1: Cargo Conundrum",
  "version": "0.2",
  "characters": {
    "pc": {
      "name": "Slim",
      "color": "#c8ffc8",
      "description": "Cowboy Cosmonaut Coder Person"
    },
    "t": {
      "name": "Terminal",
      "color": "#c8c8ff",
      "description": "Interface to the world's systems"
    },
    "clipi": {
      "name": "Clipi",
      "color": "#00ff00",
      "description": "AI assistant"
    },
    "cargo_bot": {
      "name": "Cargo Bot",
      "color": "#aaaaaa",
      "description": "Generic cargo robot"
    },
    "rustler": {
      "name": "???",
      "color": "#ff5555",
      "description": "Mystery antagonist"
    },
    "narrator": {
      "name": "Narrator",
      "color": "#ffffff",
      "description": "Narrator for non-dialogue text"
    }
  },
  "stats": {
    "cos": {
      "name": "Cosmonaut",
      "description": "Space/high-tech skills",
      "default": 0
    },
    "cow": {
      "name": "Cowboy",
      "description": "Desert/low-tech skills",
      "default": 0
    },
    "cod": {
      "name": "Coder",
      "description": "Robot communication/terminal skills",
      "default": 0
    }
  },
  "variables": {
    "approach": {
      "name": "Problem-solving Approach",
      "description": "Tracks which approach the player took",
      "default": "none"
    },
    "mission": {
      "name": "Final Mission Choice",
      "description": "Tracks the final mission choice",
      "default": "none"
    }
  },
  "scenes": [
    {
      "id": "start",
      "title": "Character Creation",
      "background": "black",
      "description": "Player selects their character background",
      "dialogue": [
        {
          "type": "narration",
          "text": "Before we begin, who are you exactly?"
        },
        {
          "type": "choice",
          "text": "Who are you?",
          "choices": [
            {
              "text": "Welcome Comrade (Space Expert)",
              "effects": [
                {
                  "type": "set",
                  "variable": "cos",
                  "value": 2
                },
                {
                  "type": "set",
                  "variable": "cow",
                  "value": -1
                },
                {
                  "type": "set",
                  "variable": "cod",
                  "value": 2
                }
              ],
              "target": "scene1_intro"
            },
            {
              "text": "Howdy Pardner (Desert Ranger)",
              "effects": [
                {
                  "type": "set",
                  "variable": "cos",
                  "value": -1
                },
                {
                  "type": "set",
                  "variable": "cow",
                  "value": 2
                },
                {
                  "type": "set",
                  "variable": "cod",
                  "value": 2
                }
              ],
              "target": "scene1_intro"
            },
            {
              "text": "Major Tom (Space Castaway)",
              "effects": [
                {
                  "type": "set",
                  "variable": "cos",
                  "value": 2
                },
                {
                  "type": "set",
                  "variable": "cow",
                  "value": 2
                },
                {
                  "type": "set",
                  "variable": "cod",
                  "value": -1
                }
              ],
              "target": "scene1_intro"
            }
          ]
        }
      ]
    },
    {
      "id": "scene1_intro",
      "title": "Scene 1: Introduction",
      "background": "bg desert night",
      "music": "audio/music/azaFMP2_field7_Tumbleweeds.ogg",
      "ambience": "audio/ambient/vgm-atmospheric-air.mp3",
      "description": "Slim is introduced alongside his assistant and the mission",
      "dialogue": [
        {
          "type": "direction",
          "text": "Show Slim in the desert"
        },
        {
          "type": "dialogue",
          "character": "pc",
          "text": "Sure is getting cold out here on Syntax-4. The triple moons are all up - gonna be a bright night.",
          "emotion": "neutral",
          "position": "left",
          "effect": "easeinleft"
        },
        {
          "type": "dialogue",
          "character": "pc",
          "text": "The Company satellite should be directly above us now. Time to check in and see what today's malfunction is.",
          "emotion": "neutral2",
          "effect": "dissolve"
        },
        {
          "type": "dialogue",
          "character": "pc",
          "text": "Clipi! You online?",
          "emotion": "talk",
          "effect": "dissolve"
        },
        {
          "type": "dialogue",
          "character": "pc",
          "text": "Where is that neural network when you need it...",
          "emotion": "normal",
          "effect": "dissolve"
        },
        {
          "type": "direction",
          "text": "Terminal appears"
        },
        {
          "type": "dialogue",
          "character": "t",
          "text": "Connecting to network...",
          "emotion": "idle",
          "position": "right",
          "effect": "easeinright"
        },
        {
          "type": "dialogue",
          "character": "t",
          "text": "Initializing co-pilot interface...",
          "emotion": "static",
          "effect": "dissolve"
        },
        {
          "type": "direction",
          "text": "Clipi appears with glitch effect"
        },
        {
          "type": "dialogue",
          "character": "clipi",
          "text": "I'm here, Slim. Systems operational."
        },
        {
          "type": "dialogue",
          "character": "pc",
          "text": "Finally! I was starting to think you'd crashed again.",
          "emotion": "talk",
          "effect": "dissolve"
        },
        {
          "type": "dialogue",
          "character": "clipi",
          "text": "Just running diagnostics. What's our assignment today?"
        },
        {
          "type": "dialogue",
          "character": "pc",
          "text": "The Company sent new coordinates for a broken link loader. Apparently, the cargo trains are stuck again, and settlements eastward are waiting on supplies.",
          "emotion": "normal",
          "effect": "dissolve"
        },
        {
          "type": "dialogue",
          "character": "t",
          "text": "Warning: Satellite connection unstable.",
          "emotion": "talk",
          "effect": "dissolve"
        },
        {
          "type": "dialogue",
          "character": "pc",
          "text": "(sudo restart satellite)",
          "emotion": "talk",
          "effect": "dissolve"
        },
        {
          "type": "dialogue",
          "character": "t",
          "text": "Welcome, root. Please enter password:",
          "emotion": "talk2",
          "effect": "dissolve"
        },
        {
          "type": "dialogue",
          "character": "pc",
          "text": "********",
          "emotion": "normal",
          "effect": "dissolve"
        },
        {
          "type": "direction",
          "text": "Terminal connects"
        },
        {
          "type": "dialogue",
          "character": "t",
          "text": "Connection established. Downloading updated assignment.",
          "emotion": "static",
          "effect": "dissolve"
        },
        {
          "type": "direction",
          "text": "Clipi glitches"
        },
        {
          "type": "dialogue",
          "character": "clipi",
          "text": "I've got the details. Link loader malfunction at coordinates delta-7. Cargo cars are stuck in a recursive loading pattern."
        },
        {
          "type": "dialogue",
          "character": "pc",
          "text": "What's the diagnosis?",
          "emotion": "talk",
          "effect": "dissolve"
        },
        {
          "type": "dialogue",
          "character": "clipi",
          "text": "Preliminary scan shows syntax errors in the cargo loading subroutines. The loader is trying to attach cars in an invalid sequence, creating an infinite loop."
        },
        {
          "type": "dialogue",
          "character": "pc",
          "text": "Another LISP logic problem? Those cargo robots and their mismatched parentheses...",
          "emotion": "frowning",
          "effect": "dissolve"
        },
        {
          "type": "dialogue",
          "character": "clipi",
          "text": "I'm not in the loop on the specific error patterns yet."
        },
        {
          "type": "dialogue",
          "character": "pc",
          "text": "Careful with that phrase, Clipi. Remember what happened last time you got stuck in a recursive language pattern.",
          "emotion": "talk",
          "effect": "dissolve"
        },
        {
          "type": "direction",
          "text": "Clipi glitches more severely"
        },
        {
          "type": "dialogue",
          "character": "clipi",
          "text": "I'm not in the (loop). I'm not in the ((loop))."
        },
        {
          "type": "dialogue",
          "character": "pc",
          "text": "Whoa there! Take a second to reboot your language processor.",
          "emotion": "frowning",
          "effect": "dissolve"
        },
        {
          "type": "direction",
          "text": "Clipi disappears"
        },
        {
          "type": "dialogue",
          "character": "t",
          "text": "Co-pilot interface restarting... Connecting to central database...",
          "emotion": "talk",
          "effect": "dissolve"
        },
        {
          "type": "dialogue",
          "character": "t",
          "text": "git pull: Loading new coordinates and repair protocols...",
          "emotion": "static",
          "effect": "dissolve"